{"languageCode": "vi", "rawText": "Chào tạm biệt mọi người, cảm ơn các bạn đã tham gia cuộc hợp lý. Hãy bắt đầu giải quyết dựng kế hoạch này. Đầu tiên, chúng ta sẽ đi qua khu vực năng trung và cơ thể đoạn sản xuất. Thứ hai là, chúng tôi sẽ nói về tuần cuối cùng. Trong đó, chúng saya sẽ gửi ít diễn ra cho mỗi đội nhóm. Cảm ơn quý vị để chắc chắn trong chuyện này. Bây giờ, chúng ta sẽ bắt đầu với tập trung của kế hoạch project từ hệ thống tiên sĩ. Một đường phía dưới là gần xong và luyện thoại vô cùng đang diễn ra. Chúng tôi mong chú ý để chiến thắng đến cuối tuần này. Có ai đó có câu hỏi không? Hãy nói chuyển về cộng tiền cho các quán tiếp theo. Chúng ta cần finalize số ảnh trước cuối năm. Cảm ơn mọi người vì thời gian của các bạn, tổng hợp này đã kết thúc.", "cleanedText": "Chào tạm biệt mọi người, cảm ơn các bạn đã tham gia cuộc hợp lý. Hãy bắt đầu giải quyết dựng kế hoạch này. Đầu tiên, chúng ta sẽ đi qua khu vực năng trung và cơ thể đoạn sản xuất. Thứ hai là, chúng tôi sẽ nói về tuần cuối cùng. Trong đó, chúng saya sẽ gửi ít diễn ra cho mỗi đội nhóm. Cảm ơn quý vị để chắc chắn trong chuyện này. Bây giờ, chúng ta sẽ bắt đầu với tập trung của kế hoạch project từ hệ thống tiên sĩ. Một đường phía dưới là gần xong và luyện thoại vô cùng đang diễn ra. Chúng tôi mong chú ý để chiến thắng đến cuối tuần này. Có ai đó có câu hỏi không? Hãy nói chuyển về cộng tiền cho các quán tiếp theo. Chúng ta cần finalize số ảnh trước cuối năm. Cảm ơn mọi người vì thời gian của các bạn, tổng hợp này đã kết thúc.", "confidenceScore": 0.31457130209531514, "segments": [{"segmentId": "seg-0000", "startMs": 0, "endMs": 4000, "text": "Chào tạm biệt mọi người, cảm ơn các bạn đã tham gia cuộc hợp lý.", "speakerLabel": "unknown", "speakerSource": "unknown", "userId": null, "channelId": null, "roomZoneLabel": null, "sttConfidence": 0.3175726642118749, "diarizationConfidence": null, "separationConfidence": null, "finalConfidence": 0.3175726642118749, "overlap": false, "lowConfidence": true, "manualReviewRequired": true, "notes": ["m1_scope_no_diarization"]}, {"segmentId": "seg-0001", "startMs": 4500, "endMs": 7500, "text": "Hãy bắt đầu giải quyết dựng kế hoạch này.", "speakerLabel": "unknown", "speakerSource": "unknown", "userId": null, "channelId": null, "roomZoneLabel": null, "sttConfidence": 0.3175726642118749, "diarizationConfidence": null, "separationConfidence": null, "finalConfidence": 0.3175726642118749, "overlap": false, "lowConfidence": true, "manualReviewRequired": true, "notes": ["m1_scope_no_diarization"]}, {"segmentId": "seg-0002", "startMs": 8000, "endMs": 13000, "text": "Đầu tiên, chúng ta sẽ đi qua khu vực năng trung và cơ thể đoạn sản xuất.", "speakerLabel": "unknown", "speakerSource": "unknown", "userId": null, "channelId": null, "roomZoneLabel": null, "sttConfidence": 0.3175726642118749, "diarizationConfidence": null, "separationConfidence": null, "finalConfidence": 0.3175726642118749, "overlap": false, "lowConfidence": true, "manualReviewRequired": true, "notes": ["m1_scope_no_diarization"]}, {"segmentId": "seg-0003", "startMs": 13500, "endMs": 17000, "text": "Thứ hai là, chúng tôi sẽ nói về tuần cuối cùng.", "speakerLabel": "unknown", "speakerSource": "unknown", "userId": null, "channelId": null, "roomZoneLabel": null, "sttConfidence": 0.3175726642118749, "diarizationConfidence": null, "separationConfidence": null, "finalConfidence": 0.3175726642118749, "overlap": false, "lowConfidence": true, "manualReviewRequired": true, "notes": ["m1_scope_no_diarization"]}, {"segmentId": "seg-0004", "startMs": 17500, "endMs": 21500, "text": "Trong đó, chúng saya sẽ gửi ít diễn ra cho mỗi đội nhóm.", "speakerLabel": "unknown", "speakerSource": "unknown", "userId": null, "channelId": null, "roomZoneLabel": null, "sttConfidence": 0.3175726642118749, "diarizationConfidence": null, "separationConfidence": null, "finalConfidence": 0.3175726642118749, "overlap": false, "lowConfidence": true, "manualReviewRequired": true, "notes": ["m1_scope_no_diarization"]}, {"segmentId": "seg-0005", "startMs": 22000, "endMs": 25500, "text": "Cảm ơn quý vị để chắc chắn trong chuyện này.", "speakerLabel": "unknown", "speakerSource": "unknown", "userId": null, "channelId": null, "roomZoneLabel": null, "sttConfidence": 0.3175726642118749, "diarizationConfidence": null, "separationConfidence": null, "finalConfidence": 0.3175726642118749, "overlap": false, "lowConfidence": true, "manualReviewRequired": true, "notes": ["m1_scope_no_diarization"]}, {"segmentId": "seg-0006", "startMs": 25500, "endMs": 30500, "text": "Bây giờ, chúng ta sẽ bắt đầu với tập trung của kế hoạch project từ hệ thống tiên sĩ.", "speakerLabel": "unknown", "speakerSource": "unknown", "userId": null, "channelId": null, "roomZoneLabel": null, "sttConfidence": 0.29199747516704005, "diarizationConfidence": null, "separationConfidence": null, "finalConfidence": 0.29199747516704005, "overlap": false, "lowConfidence": true, "manualReviewRequired": true, "notes": ["m1_scope_no_diarization"]}, {"segmentId": "seg-0007", "startMs": 31500, "endMs": 36500, "text": "Một đường phía dưới là gần xong và luyện thoại vô cùng đang diễn ra.", "speakerLabel": "unknown", "speakerSource": "unknown", "userId": null, "channelId": null, "roomZoneLabel": null, "sttConfidence": 0.29199747516704005, "diarizationConfidence": null, "separationConfidence": null, "finalConfidence": 0.29199747516704005, "overlap": false, "lowConfidence": true, "manualReviewRequired": true, "notes": ["m1_scope_no_diarization"]}, {"segmentId": "seg-0008", "startMs": 37500, "endMs": 40500, "text": "Chúng tôi mong chú ý để chiến thắng đến cuối tuần này.", "speakerLabel": "unknown", "speakerSource": "unknown", "userId": null, "channelId": null, "roomZoneLabel": null, "sttConfidence": 0.29199747516704005, "diarizationConfidence": null, "separationConfidence": null, "finalConfidence": 0.29199747516704005, "overlap": false, "lowConfidence": true, "manualReviewRequired": true, "notes": ["m1_scope_no_diarization"]}, {"segmentId": "seg-0009", "startMs": 41500, "endMs": 44500, "text": "Có ai đó có câu hỏi không?", "speakerLabel": "unknown", "speakerSource": "unknown", "userId": null, "channelId": null, "roomZoneLabel": null, "sttConfidence": 0.29199747516704005, "diarizationConfidence": null, "separationConfidence": null, "finalConfidence": 0.29199747516704005, "overlap": false, "lowConfidence": true, "manualReviewRequired": true, "notes": ["m1_scope_no_diarization"]}, {"segmentId": "seg-0010", "startMs": 45500, "endMs": 48500, "text": "Hãy nói chuyển về cộng tiền cho các quán tiếp theo.", "speakerLabel": "unknown", "speakerSource": "unknown", "userId": null, "channelId": null, "roomZoneLabel": null, "sttConfidence": 0.29199747516704005, "diarizationConfidence": null, "separationConfidence": null, "finalConfidence": 0.29199747516704005, "overlap": false, "lowConfidence": true, "manualReviewRequired": true, "notes": ["m1_scope_no_diarization"]}, {"segmentId": "seg-0011", "startMs": 49500, "endMs": 52500, "text": "Chúng ta cần finalize số ảnh trước cuối năm.", "speakerLabel": "unknown", "speakerSource": "unknown", "userId": null, "channelId": null, "roomZoneLabel": null, "sttConfidence": 0.29199747516704005, "diarizationConfidence": null, "separationConfidence": null, "finalConfidence": 0.29199747516704005, "overlap": false, "lowConfidence": true, "manualReviewRequired": true, "notes": ["m1_scope_no_diarization"]}, {"segmentId": "seg-0012", "startMs": 52500, "endMs": 56500, "text": "Cảm ơn mọi người vì thời gian của các bạn, tổng hợp này đã kết thúc.", "speakerLabel": "unknown", "speakerSource": "unknown", "userId": null, "channelId": null, "roomZoneLabel": null, "sttConfidence": 0.43200609096560677, "diarizationConfidence": null, "separationConfidence": null, "finalConfidence": 0.43200609096560677, "overlap": false, "lowConfidence": true, "manualReviewRequired": true, "notes": ["m1_scope_no_diarization"]}], "detectedSpeakers": [], "modelVersions": {"whisper": "medium", "pyannote": null, "sepformer": null}, "warnings": ["low_confidence_transcript"]}