{"languageCode": "vi", "rawText": "Xin chào tất cả mọi người, cảm ơn các bạn for joining today's meeting. Let us begin by reviewing the agenda of this session First We will go over project status and current blockers Second we'll discuss budget next quarter Third we assign action items to each team member Please make sure take notes during discussion Bây giờ, chúng ta bắt đầu với tập trọng đoán pháp từ công ty kế hoạch. Một mục tiêu của các quý vị sử dụng là xong thật và một vấn đề hợp ảnh đang trong năng lượng. Chúng ta expect to finish testing by the end of this week! Có ai có câu chuyện trước khi chúng tôi đi đến next topic? Nói sẽ nói về cơ hội liên quan for Next Quarter Các bạn cần phải kiểm tra những tuyệt vời trước này. Cảm ơn mọi người for your time, this meeting is now concluded.", "cleanedText": "Xin chào tất cả mọi người, cảm ơn các bạn for joining today's meeting. Let us begin by reviewing the agenda of this session First We will go over project status and current blockers Second we'll discuss budget next quarter Third we assign action items to each team member Please make sure take notes during discussion Bây giờ, chúng ta bắt đầu với tập trọng đoán pháp từ công ty kế hoạch. Một mục tiêu của các quý vị sử dụng là xong thật và một vấn đề hợp ảnh đang trong năng lượng. Chúng ta expect to finish testing by the end of this week! Có ai có câu chuyện trước khi chúng tôi đi đến next topic? Nói sẽ nói về cơ hội liên quan for Next Quarter Các bạn cần phải kiểm tra những tuyệt vời trước này. Cảm ơn mọi người for your time, this meeting is now concluded.", "confidenceScore": 0.48002943405545984, "segments": [{"segmentId": "seg-0000", "startMs": 0, "endMs": 4420, "text": "Xin chào tất cả mọi người, cảm ơn các bạn for joining today's meeting.", "speakerLabel": "unknown", "speakerSource": "unknown", "userId": null, "channelId": null, "roomZoneLabel": null, "sttConfidence": 0.640284476755919, "diarizationConfidence": null, "separationConfidence": null, "finalConfidence": 0.640284476755919, "overlap": false, "lowConfidence": false, "manualReviewRequired": false, "notes": []}, {"segmentId": "seg-0001", "startMs": 4440, "endMs": 8120, "text": "Let us begin by reviewing the agenda of this session", "speakerLabel": "unknown", "speakerSource": "unknown", "userId": null, "channelId": null, "roomZoneLabel": null, "sttConfidence": 0.640284476755919, "diarizationConfidence": null, "separationConfidence": null, "finalConfidence": 0.640284476755919, "overlap": false, "lowConfidence": false, "manualReviewRequired": false, "notes": []}, {"segmentId": "seg-0002", "startMs": 8140, "endMs": 9120, "text": "First", "speakerLabel": "unknown", "speakerSource": "unknown", "userId": null, "channelId": null, "roomZoneLabel": null, "sttConfidence": 0.640284476755919, "diarizationConfidence": null, "separationConfidence": null, "finalConfidence": 0.640284476755919, "overlap": false, "lowConfidence": false, "manualReviewRequired": false, "notes": []}, {"segmentId": "seg-0003", "startMs": 9140, "endMs": 13220, "text": "We will go over project status and current blockers", "speakerLabel": "unknown", "speakerSource": "unknown", "userId": null, "channelId": null, "roomZoneLabel": null, "sttConfidence": 0.640284476755919, "diarizationConfidence": null, "separationConfidence": null, "finalConfidence": 0.640284476755919, "overlap": false, "lowConfidence": false, "manualReviewRequired": false, "notes": []}, {"segmentId": "seg-0004", "startMs": 13240, "endMs": 14240, "text": "Second", "speakerLabel": "unknown", "speakerSource": "unknown", "userId": null, "channelId": null, "roomZoneLabel": null, "sttConfidence": 0.640284476755919, "diarizationConfidence": null, "separationConfidence": null, "finalConfidence": 0.640284476755919, "overlap": false, "lowConfidence": false, "manualReviewRequired": false, "notes": []}, {"segmentId": "seg-0005", "startMs": 14260, "endMs": 17560, "text": "we'll discuss budget next quarter", "speakerLabel": "unknown", "speakerSource": "unknown", "userId": null, "channelId": null, "roomZoneLabel": null, "sttConfidence": 0.640284476755919, "diarizationConfidence": null, "separationConfidence": null, "finalConfidence": 0.640284476755919, "overlap": false, "lowConfidence": false, "manualReviewRequired": false, "notes": []}, {"segmentId": "seg-0006", "startMs": 17580, "endMs": 18420, "text": "Third", "speakerLabel": "unknown", "speakerSource": "unknown", "userId": null, "channelId": null, "roomZoneLabel": null, "sttConfidence": 0.640284476755919, "diarizationConfidence": null, "separationConfidence": null, "finalConfidence": 0.640284476755919, "overlap": false, "lowConfidence": false, "manualReviewRequired": false, "notes": []}, {"segmentId": "seg-0007", "startMs": 18440, "endMs": 22080, "text": "we assign action items to each team member", "speakerLabel": "unknown", "speakerSource": "unknown", "userId": null, "channelId": null, "roomZoneLabel": null, "sttConfidence": 0.640284476755919, "diarizationConfidence": null, "separationConfidence": null, "finalConfidence": 0.640284476755919, "overlap": false, "lowConfidence": false, "manualReviewRequired": false, "notes": []}, {"segmentId": "seg-0008", "startMs": 22100, "endMs": 25920, "text": "Please make sure take notes during discussion", "speakerLabel": "unknown", "speakerSource": "unknown", "userId": null, "channelId": null, "roomZoneLabel": null, "sttConfidence": 0.640284476755919, "diarizationConfidence": null, "separationConfidence": null, "finalConfidence": 0.640284476755919, "overlap": false, "lowConfidence": false, "manualReviewRequired": false, "notes": []}, {"segmentId": "seg-0009", "startMs": 25920, "endMs": 31320, "text": "Bây giờ, chúng ta bắt đầu với tập trọng đoán pháp từ công ty kế hoạch.", "speakerLabel": "unknown", "speakerSource": "unknown", "userId": null, "channelId": null, "roomZoneLabel": null, "sttConfidence": 0.23404049961027207, "diarizationConfidence": null, "separationConfidence": null, "finalConfidence": 0.23404049961027207, "overlap": false, "lowConfidence": true, "manualReviewRequired": true, "notes": ["m1_scope_no_diarization"]}, {"segmentId": "seg-0010", "startMs": 31480, "endMs": 37640, "text": "Một mục tiêu của các quý vị sử dụng là xong thật và một vấn đề hợp ảnh đang trong năng lượng.", "speakerLabel": "unknown", "speakerSource": "unknown", "userId": null, "channelId": null, "roomZoneLabel": null, "sttConfidence": 0.23404049961027207, "diarizationConfidence": null, "separationConfidence": null, "finalConfidence": 0.23404049961027207, "overlap": false, "lowConfidence": true, "manualReviewRequired": true, "notes": ["m1_scope_no_diarization"]}, {"segmentId": "seg-0011", "startMs": 37680, "endMs": 41480, "text": "Chúng ta expect to finish testing by the end of this week!", "speakerLabel": "unknown", "speakerSource": "unknown", "userId": null, "channelId": null, "roomZoneLabel": null, "sttConfidence": 0.23404049961027207, "diarizationConfidence": null, "separationConfidence": null, "finalConfidence": 0.23404049961027207, "overlap": false, "lowConfidence": true, "manualReviewRequired": true, "notes": ["m1_scope_no_diarization"]}, {"segmentId": "seg-0012", "startMs": 41500, "endMs": 45480, "text": "Có ai có câu chuyện trước khi chúng tôi đi đến next topic?", "speakerLabel": "unknown", "speakerSource": "unknown", "userId": null, "channelId": null, "roomZoneLabel": null, "sttConfidence": 0.23404049961027207, "diarizationConfidence": null, "separationConfidence": null, "finalConfidence": 0.23404049961027207, "overlap": false, "lowConfidence": true, "manualReviewRequired": true, "notes": ["m1_scope_no_diarization"]}, {"segmentId": "seg-0013", "startMs": 45520, "endMs": 49940, "text": "Nói sẽ nói về cơ hội liên quan for Next Quarter", "speakerLabel": "unknown", "speakerSource": "unknown", "userId": null, "channelId": null, "roomZoneLabel": null, "sttConfidence": 0.23404049961027207, "diarizationConfidence": null, "separationConfidence": null, "finalConfidence": 0.23404049961027207, "overlap": false, "lowConfidence": true, "manualReviewRequired": true, "notes": ["m1_scope_no_diarization"]}, {"segmentId": "seg-0014", "startMs": 49960, "endMs": 54000, "text": "Các bạn cần phải kiểm tra những tuyệt vời trước này.", "speakerLabel": "unknown", "speakerSource": "unknown", "userId": null, "channelId": null, "roomZoneLabel": null, "sttConfidence": 0.23404049961027207, "diarizationConfidence": null, "separationConfidence": null, "finalConfidence": 0.23404049961027207, "overlap": false, "lowConfidence": true, "manualReviewRequired": true, "notes": ["m1_scope_no_diarization"]}, {"segmentId": "seg-0015", "startMs": 54000, "endMs": 58000, "text": "Cảm ơn mọi người for your time, this meeting is now concluded.", "speakerLabel": "unknown", "speakerSource": "unknown", "userId": null, "channelId": null, "roomZoneLabel": null, "sttConfidence": 0.5136676564224535, "diarizationConfidence": null, "separationConfidence": null, "finalConfidence": 0.5136676564224535, "overlap": false, "lowConfidence": false, "manualReviewRequired": false, "notes": []}], "detectedSpeakers": [], "modelVersions": {"whisper": "small", "pyannote": null, "sepformer": null}, "warnings": ["low_confidence_transcript"]}