{"languageCode": "en", "rawText": "This is the first speech segment. We are testing whether voice activity detection correctly skips silence Now we're speaking again after a long silent pause, to check The second Speech Segment this Is third and final segment confirming that pipeline handles multiple speech and silence sections correctly.", "cleanedText": "This is the first speech segment. We are testing whether voice activity detection correctly skips silence Now we're speaking again after a long silent pause, to check The second Speech Segment this Is third and final segment confirming that pipeline handles multiple speech and silence sections correctly.", "confidenceScore": 0.7063251402008012, "segments": [{"segmentId": "seg-0000", "startMs": 0, "endMs": 2960, "text": "This is the first speech segment.", "speakerLabel": "unknown", "speakerSource": "unknown", "userId": null, "channelId": null, "roomZoneLabel": null, "sttConfidence": 0.6996654096867571, "diarizationConfidence": null, "separationConfidence": null, "finalConfidence": 0.6996654096867571, "overlap": false, "lowConfidence": false, "manualReviewRequired": false, "notes": []}, {"segmentId": "seg-0001", "startMs": 2980, "endMs": 15000, "text": "We are testing whether voice activity detection correctly skips silence", "speakerLabel": "unknown", "speakerSource": "unknown", "userId": null, "channelId": null, "roomZoneLabel": null, "sttConfidence": 0.6996654096867571, "diarizationConfidence": null, "separationConfidence": null, "finalConfidence": 0.6996654096867571, "overlap": false, "lowConfidence": false, "manualReviewRequired": false, "notes": []}, {"segmentId": "seg-0002", "startMs": 15020, "endMs": 19000, "text": "Now we're speaking again after a long silent pause, to check", "speakerLabel": "unknown", "speakerSource": "unknown", "userId": null, "channelId": null, "roomZoneLabel": null, "sttConfidence": 0.6996654096867571, "diarizationConfidence": null, "separationConfidence": null, "finalConfidence": 0.6996654096867571, "overlap": false, "lowConfidence": false, "manualReviewRequired": false, "notes": []}, {"segmentId": "seg-0003", "startMs": 19020, "endMs": 29490, "text": "The second Speech Segment", "speakerLabel": "unknown", "speakerSource": "unknown", "userId": null, "channelId": null, "roomZoneLabel": null, "sttConfidence": 0.6996654096867571, "diarizationConfidence": null, "separationConfidence": null, "finalConfidence": 0.6996654096867571, "overlap": false, "lowConfidence": false, "manualReviewRequired": false, "notes": []}, {"segmentId": "seg-0004", "startMs": 29510, "endMs": 31850, "text": "this Is third and final segment", "speakerLabel": "unknown", "speakerSource": "unknown", "userId": null, "channelId": null, "roomZoneLabel": null, "sttConfidence": 0.6996654096867571, "diarizationConfidence": null, "separationConfidence": null, "finalConfidence": 0.6996654096867571, "overlap": false, "lowConfidence": false, "manualReviewRequired": false, "notes": []}, {"segmentId": "seg-0005", "startMs": 31870, "endMs": 34130, "text": "confirming that pipeline handles multiple", "speakerLabel": "unknown", "speakerSource": "unknown", "userId": null, "channelId": null, "roomZoneLabel": null, "sttConfidence": 0.6996654096867571, "diarizationConfidence": null, "separationConfidence": null, "finalConfidence": 0.6996654096867571, "overlap": false, "lowConfidence": false, "manualReviewRequired": false, "notes": []}, {"segmentId": "seg-0006", "startMs": 34130, "endMs": 36530, "text": "speech and silence sections correctly.", "speakerLabel": "unknown", "speakerSource": "unknown", "userId": null, "channelId": null, "roomZoneLabel": null, "sttConfidence": 0.7462835232850663, "diarizationConfidence": null, "separationConfidence": null, "finalConfidence": 0.7462835232850663, "overlap": false, "lowConfidence": false, "manualReviewRequired": false, "notes": []}], "detectedSpeakers": [], "modelVersions": {"whisper": "medium", "pyannote": null, "sepformer": null}, "warnings": []}